{
  "mode": "draft-only",
  "publishing_enabled": false,
  "commenting_enabled": false,
  "cookie_import_enabled": true,
  "bulk_import_enabled": false,
  "cron_publish_enabled": false,
  "max_daily_publishes": 1,
  "max_daily_comments": 0,
  "require_approval_for_publish": true,
  "require_approval_for_comment": true,
  "cooldown_on_risk_signal": true
}
